[
  {
    "id": "CLI-VERSION-001",
    "category": "version",
    "title": "Responds to --version with a version number",
    "severity": "warn",
    "rationale": "A discoverable version string is essential for debugging and bug reports.",
    "remediation": "Implement --version to print a version like '1.2.0' to stdout and exit 0.",
    "source": ["clig.dev: Arguments and flags", "12 Factor CLI Apps"],
    "probe": "version"
  },
  {
    "id": "CLI-VERSION-002",
    "category": "version",
    "title": "Responds to -V as a version alias",
    "severity": "info",
    "rationale": "-V is the conventional short form for --version.",
    "remediation": "Map -V to the same behavior as --version.",
    "source": ["clig.dev: Arguments and flags"],
    "probe": "version"
  }
]
