[
  {
    "id": "CLI-HELP-001",
    "category": "help",
    "title": "Responds to --help with help on stdout",
    "severity": "error",
    "rationale": "--help is the first surface users and agents reach for. It must print help to stdout and exit 0.",
    "remediation": "Implement --help to print full usage to stdout and exit 0.",
    "source": ["clig.dev: Help", "12 Factor CLI Apps"],
    "probe": "help"
  },
  {
    "id": "CLI-HELP-002",
    "category": "help",
    "title": "Responds to -h as a help alias",
    "severity": "warn",
    "rationale": "-h is the conventional short form of --help; supporting it meets user expectations.",
    "remediation": "Map -h to the same behavior as --help.",
    "source": ["clig.dev: Help", "clig.dev: Arguments and flags"],
    "probe": "help"
  },
  {
    "id": "CLI-HELP-003",
    "category": "help",
    "title": "Help includes a usage synopsis",
    "severity": "warn",
    "rationale": "A usage/synopsis line shows the command shape at a glance before the option list.",
    "remediation": "Include a 'Usage:' (or 'Synopsis:') line in help output.",
    "source": ["clig.dev: Help"],
    "probe": "help"
  },
  {
    "id": "CLI-HELP-004",
    "category": "help",
    "title": "Help shows examples",
    "severity": "warn",
    "rationale": "Concrete examples are the fastest way for a human or agent to learn a command; clig.dev recommends leading with them.",
    "remediation": "Add an 'Examples:' section to help output with a few real invocations.",
    "source": ["clig.dev: Help", "12 Factor CLI Apps"],
    "probe": "help"
  }
]
