[
  {
    "id": "CLI-ROBUST-001",
    "category": "robustness",
    "title": "Responds quickly to --help",
    "severity": "warn",
    "rationale": "Startup time is part of a CLI's UX; help in particular should feel instant. Defer heavy work until the invoked command needs it.",
    "remediation": "Avoid loading heavy dependencies before parsing arguments; keep --help fast.",
    "source": ["clig.dev: Robustness", "12 Factor CLI Apps"],
    "probe": "robustness"
  },
  {
    "id": "CLI-ROBUST-002",
    "category": "robustness",
    "title": "Does not hang when run with no arguments",
    "severity": "error",
    "rationale": "A CLI that silently blocks on stdin when arguments are missing looks frozen to users and stalls scripts and agents.",
    "remediation": "When required input is missing, print help or an error and exit; do not block on a TTY read.",
    "source": ["clig.dev: Help", "clig.dev: Interactivity"],
    "probe": "robustness"
  }
]
